{
  "_metadata": {
    "artifact_id": "token_dictionary",
    "version": "0.0",
    "country": "ng",
    "schema_version": "2.0",
    "release_status": "candidate_unapproved",
    "release_date": null,
    "generated_at": "2026-08-14T00:00:00Z",
    "generator": "tools/build_search_fixtures.py",
    "generator_version": "1.0.0",
    "SYNTHETIC_FIXTURE": true,
    "WARNING": "SYNTHETIC NON-CLINICAL TEST FIXTURE. Token IDs are nonsense words. This file must never be published, uploaded to R2, referenced by a manifest, or used as a source of clinical vocabulary.",
    "description": "Synthetic vocabulary used only to exercise the ambiguity contract, which the real vocabulary cannot currently demonstrate (it has zero label collisions and zero aliases).",
    "source_artifact": {
      "artifact_id": "token_dictionary",
      "version": "0.0",
      "file": "none - synthetic",
      "sha256": "0000000000000000000000000000000000000000000000000000000000000000"
    },
    "rollback_target": {
      "artifact_id": "token_dictionary",
      "version": "0.0",
      "file": "none - synthetic",
      "sha256": "0000000000000000000000000000000000000000000000000000000000000000"
    },
    "compatible_consumers": {},
    "clinical_review": {
      "status": "not_reviewed",
      "reviewer": null,
      "review_date": null,
      "evidence": null
    },
    "total_tokens": 5,
    "changelog": [
      "Synthetic fixture. Not a release artifact."
    ],
    "provenance": [
      "Generated by tools/build_search_fixtures.py. Contains no clinical content."
    ]
  },
  "symptom_tokens": [
    "zorble_alpha",
    "zorble_beta",
    "plaxo_thing",
    "frobnitz"
  ],
  "red_flag_tokens": [
    "quibble_widget"
  ],
  "duration_tokens": [],
  "body_area_tokens": [],
  "demographic_tokens": [],
  "severity_tokens": [],
  "body_areas": [],
  "complaint_groups": [],
  "tokens": [
    {
      "token_id": "zorble_alpha",
      "category": "symptom_tokens",
      "clinical_identity": {
        "canonical_token_id": "zorble_alpha",
        "status": "active",
        "replaced_by": null,
        "scoring_eligible": true,
        "introduced_in_artifact_version": "1.0"
      },
      "display": {
        "canonical_label": "Zorble alpha",
        "label_source": "clinically_approved",
        "label_review_status": "approved",
        "display_safe": true,
        "locale": "en-NG"
      },
      "search": {
        "normalized_form": "zorble alpha",
        "aliases": [
          "shared quux"
        ],
        "search_only": true
      },
      "associations": {
        "body_areas": [],
        "complaint_groups": [],
        "severity_descriptors": [],
        "duration_descriptors": []
      },
      "review": {
        "review_status": "reviewed",
        "clinical_reviewer": "SYNTHETIC FIXTURE - NOT A REAL REVIEWER",
        "review_date": "2026-01-01",
        "provenance": "synthetic non-clinical schema fixture"
      }
    },
    {
      "token_id": "zorble_beta",
      "category": "symptom_tokens",
      "clinical_identity": {
        "canonical_token_id": "zorble_beta",
        "status": "active",
        "replaced_by": null,
        "scoring_eligible": true,
        "introduced_in_artifact_version": "1.0"
      },
      "display": {
        "canonical_label": "Zorble beta",
        "label_source": "clinically_approved",
        "label_review_status": "approved",
        "display_safe": true,
        "locale": "en-NG"
      },
      "search": {
        "normalized_form": "zorble beta",
        "aliases": [
          "beta only",
          "shared quux"
        ],
        "search_only": true
      },
      "associations": {
        "body_areas": [],
        "complaint_groups": [],
        "severity_descriptors": [],
        "duration_descriptors": []
      },
      "review": {
        "review_status": "reviewed",
        "clinical_reviewer": "SYNTHETIC FIXTURE - NOT A REAL REVIEWER",
        "review_date": "2026-01-01",
        "provenance": "synthetic non-clinical schema fixture"
      }
    },
    {
      "token_id": "plaxo_thing",
      "category": "symptom_tokens",
      "clinical_identity": {
        "canonical_token_id": "plaxo_thing",
        "status": "active",
        "replaced_by": null,
        "scoring_eligible": true,
        "introduced_in_artifact_version": "1.0"
      },
      "display": {
        "canonical_label": "Quibble widget",
        "label_source": "clinically_approved",
        "label_review_status": "approved",
        "display_safe": true,
        "locale": "en-NG"
      },
      "search": {
        "normalized_form": "plaxo thing",
        "aliases": [],
        "search_only": true
      },
      "associations": {
        "body_areas": [],
        "complaint_groups": [],
        "severity_descriptors": [],
        "duration_descriptors": []
      },
      "review": {
        "review_status": "reviewed",
        "clinical_reviewer": "SYNTHETIC FIXTURE - NOT A REAL REVIEWER",
        "review_date": "2026-01-01",
        "provenance": "synthetic non-clinical schema fixture"
      }
    },
    {
      "token_id": "quibble_widget",
      "category": "red_flag_tokens",
      "clinical_identity": {
        "canonical_token_id": "quibble_widget",
        "status": "active",
        "replaced_by": null,
        "scoring_eligible": true,
        "introduced_in_artifact_version": "1.0"
      },
      "display": {
        "canonical_label": "Quibble widget",
        "label_source": "clinically_approved",
        "label_review_status": "approved",
        "display_safe": true,
        "locale": "en-NG"
      },
      "search": {
        "normalized_form": "quibble widget",
        "aliases": [],
        "search_only": true
      },
      "associations": {
        "body_areas": [],
        "complaint_groups": [],
        "severity_descriptors": [],
        "duration_descriptors": []
      },
      "review": {
        "review_status": "reviewed",
        "clinical_reviewer": "SYNTHETIC FIXTURE - NOT A REAL REVIEWER",
        "review_date": "2026-01-01",
        "provenance": "synthetic non-clinical schema fixture"
      }
    },
    {
      "token_id": "frobnitz",
      "category": "symptom_tokens",
      "clinical_identity": {
        "canonical_token_id": "frobnitz",
        "status": "active",
        "replaced_by": null,
        "scoring_eligible": true,
        "introduced_in_artifact_version": "1.0"
      },
      "display": {
        "canonical_label": "Frobnitz",
        "label_source": "clinically_approved",
        "label_review_status": "approved",
        "display_safe": true,
        "locale": "en-NG"
      },
      "search": {
        "normalized_form": "frobnitz",
        "aliases": [
          "frob nitz",
          "FROBNITZ!"
        ],
        "search_only": true
      },
      "associations": {
        "body_areas": [],
        "complaint_groups": [],
        "severity_descriptors": [],
        "duration_descriptors": []
      },
      "review": {
        "review_status": "reviewed",
        "clinical_reviewer": "SYNTHETIC FIXTURE - NOT A REAL REVIEWER",
        "review_date": "2026-01-01",
        "provenance": "synthetic non-clinical schema fixture"
      }
    }
  ],
  "search_index": {
    "normalization_version": "1.0.0",
    "resolver_version": "1.0.0",
    "normalized_forms": {
      "beta only": [
        "zorble_beta"
      ],
      "frob nitz": [
        "frobnitz"
      ],
      "frobnitz": [
        "frobnitz"
      ],
      "plaxo thing": [
        "plaxo_thing"
      ],
      "quibble widget": [
        "quibble_widget",
        "plaxo_thing"
      ],
      "shared quux": [
        "zorble_alpha",
        "zorble_beta"
      ],
      "zorble alpha": [
        "zorble_alpha"
      ],
      "zorble beta": [
        "zorble_beta"
      ]
    }
  }
}
